[
  {
    "phrase": "terror",
    "neutral": "attack",
    "type": "fear",
    "explanation": "Fear-loaded term that escalates perception.",
    "aliases": []
  },
  {
    "phrase": "panic",
    "neutral": "concern",
    "type": "fear",
    "explanation": "Inflates urgency unnecessarily.",
    "aliases": []
  },
  {
    "phrase": "fears",
    "neutral": "concerns",
    "type": "fear",
    "explanation": "Amplifies anxiety about topics.",
    "aliases": []
  },
  {
    "phrase": "threat",
    "neutral": "risk",
    "type": "fear",
    "explanation": "More alarming than what it describes.",
    "aliases": []
  },
  {
    "phrase": "crisis",
    "neutral": "problem",
    "type": "fear",
    "explanation": "Escalates severity of situations.",
    "aliases": ["crises"]
  }
]
